,origin,Unnamed: 0,text,author.userName,misinformation,stance,isUSRelated,notes,opinion_label,true_label,claimbuster_score
715,T2,1143745,"@PetenShirl @MailOnline When I worked in housing, it always amazed me how easy it was for so called asylum seekers &amp; refugees living on benefits, to acquire cars often even without a driving licence.",crazyzombienerd,E,A,0,,0,0.0,0.4949198724
716,T2,1310906,@PetenShirl Even I coming from a legal immigrant stock agree that UK needs to stop ALL migrarion/immigration until people already in the country are sorted. We have enough people lounging on benefits to fill a lot of job vacancies.,crazyzombienerd,O,A,0,,1,,0.7313872636
717,T4,74197,"@mrmrnononsense @SeekHisFaceUK @DaveAtherton20 @RishiSunak Of course, immigrants with UK citizenship can get disability &amp; all other benefits.",crazyzombienerd,T,U,0,,0,1.0,0.6226349368
718,T2,1386374,"@jeremypssm @kinyenoC Yep, &amp; like all the illegal migrants who get priority over every UK citizen.",crazyzombienerd,F,A,0,,0,0.0,0.6817226089
719,T4,518737,"Police have charged with murder the boyfriend of an Irish immigrant bartender stabbed to death inside the Queens pub where she worked.

Marcin Pieciak, 36, had a knife in both hands when he allegedly attacked girlfriend Sarah McNally inside Ceili House in Maspeth Saturday evening. He then turned the knives on himself and was initially listed in critical condition.

He is charged with two counts of weapon possession in addition to murder.

Pieciak and McNally, a native of Longford, Ireland,had been living together in Glendale for about a year.

Pieciak has been arrested for domestic violence before but it wasn’t immediately clear if these attacks involved McNally.

https://t.co/vkJ6aqA2Od",CrimeInNYC,T,U,1,,0,1.0,0.7945918503
720,T3,1558640,"For a moment I thought ""We have a few new folks joining the team"" referred to all the migrants pouring across the border.",CrimeInNYC,O,A,1,,1,,0.5379462142
721,T4,400707,"It is only a matter of time before demands begin to expand coverage to ""undocumented immigrants"" - as we delicately like to describe them - below the age of 65.

Those who spend their lives working on the books and paying taxes will cover the costs.",CrimeInNYC,E,A,1,,0,0.0,0.4872488962
722,T3,1577498,"What happens if Texas sends another 10,000 or so? What if they send another 50,000? Then what happens?
--------------------------

GOP Rockland County Executive Ed Day had warned over the weekend that he already had cops deployed to thwart any incoming migrants sent from the Big Apple — adding, “Mr. Adams, you can try to run us over, [and] I will reach up and grab you by the throat for the people of Rockland County.”

[Orange County Executive Steve] Neuhaus, also a Republican, revealed earlier Tuesday that Adams contacted him last week to say the city was going to pay for about 60 migrants to stay at the Crossroads Hotel in Newburgh in Orange.

Under the counties’ state-of-emergency declarations, hotels, motels and other short-term rentals in the region are prohibited from accepting asylum-seekers bused there.

Newburgh Town Supervisor Gil Piaquadio said Tuesday that town codes already prohibit hotels or motels from being used as shelters there.

“A shelter is not permitted at the Crossroads Hotel,” he said in a statement.

“The Town of Newburgh has a litany of procedures for outside governments to follow when these outside governments, like New York City, propose a use in another jurisdiction. New York City still needs to follow these procedures.”

https://t.co/ATgZbkILhs",CrimeInNYC,T,U,1,stance inconsistency: Sam coded as Anti-immigration,0,1.0,0.691265015
723,T4,599249,"When you don't defend the outer perimeter, the disrespect for boundaries advances to the interior. 💡
===============

A New York Home Depot has deployed a guard dog — and other stores may be close behind — to protect shoppers from aggressive migrants and thieves flooding their parking lots.

Two men wearing MSA Security caps and bulletproof vests with a German Shepherd in tow patrolled the Home Depot in New Rochelle on Tuesday.

The guarded New Rochelle lot was quiet and no migrants loitered there when The Post visited this week, however, seven miles away in Throggs Neck, The Bronx, at least 30 male migrants hovered at the doors of Home Depot.

Some were day laborers simply trying to “shape” for work with local contractors.

But many others aggressively confronted shoppers, trying to sell them phony Apple Airpods or soliciting tips for lifting items from shopping carts into cars — even when uninvited.

“You come out and you’re a woman by yourself, they literally leech onto your wagon, and you’re like ‘No, I don’t need any help,'” one worker said. “And when they’re following you to your car, it’s unnerving.”

She said a female supervisor saw one of the men washing his privates with a water bottle in the lot, and that several women have called customer service to complain that migrants robbed them of purses or phones.

“I came to work one day and there had to be 100 guys out here,” she said. “And I’m like, ‘Oh, my God!'”

https://t.co/Ev35IzmiMf",CrimeInNYC,E,A,1,,0,0.0,0.7912752946
724,T2,1338590,@csomalian @POTUS @VP @hamse_warfa  Refugees and immigrants are hopeful and he must fight against Humanitarian Corruption of the @Refugees as a Globally to save refugees lives. https://t.co/BuvW7IQuhG,csomalian,O,P,1,,1,,0.4826117515
725,T4,850487,"@csomalian @POTUS  @FLOTUS  @Ilhan @IlhanMN  @RepRashida @RashidaTlaib @RepAOC @AOC YOUNG Representives of @TheDemocrats party and their efforts.

On the other hand just Remaining Humanitarian Corruption in INDIA for the past three decades that is all.
@Refugees @UNmigration @VP https://t.co/ZsO7lkFeBz",csomalian,NR,NR,NR,"NR, discusses political figures and organizations",0,,0.4676863414
726,T3,1516500,"@csomalian @Refugees Do no depending upon the Corrupted organization of the UNHCR UNHCR across #INDIA.

@UNmigration  @IOMatUN  @JoeBiden  @POTUS  @FLOTUS  @DrBiden  @VP  @Ilhan  @RepJayapal @JustinTrudeau @HonAhmedHussen @narendramodi @AmitShahOffice  @AmitShah @RahulGandhi https://t.co/wcHxDs1dgs",csomalian,O,A,0,,1,,0.6691466642
727,T4,372809,"@philipnolan1 Not to mention that all immigrants coming to Ireland need to be ""deprogrammed"" because they've been brainwashed and infiltrated by ISIS.",culladgh,F,A,0,,0,0.0,0.4875562526
728,T3,1541132,@Fitzydub @rtenews Denying children seeking asylum 4 euro a day Paul? And you want to send them home? Do you care about children Paul? Or are you just this wicked?,culladgh,E,P,0,,0,0.0,0.6063830954
729,T4,492985,"@Fitzydub @griptmedia I read this and I cannot help but think that you would feel very different if it was an immigrant defending themselves from you and your racists pals. I know it, you know it and the baby Jesus knows it.",culladgh,O,P,1,,1,,0.2625850003
730,T2,1479578,"@mark_omahony1 Covid19 aside, traveling to the states.

ESTA Visa
Immigration questions, scan fingerprints, iris scan and photo taken.

Throw in covid rules.

I suppose Dublin Airport is like North Korea.",culladgh,E,P,0,Mia coded the stance as Unsure,0,0.0,0.4988214741
731,T2,1271367,November 2021 Immigrant Visa Statistics show only 16 #DV2022 visas issued worldwide in that whole month. https://t.co/L8ZYiyiRvh https://t.co/7olIZ5p0xa,curtismorrison,T,I,1,,0,1.0,0.8172202885
732,T2,1375252,Note: the only reason we’re having to brief this motion is because the anti-Immigrant Biden Administration continues to refuse to issue immigrant visas to family members of US citizens and green card holders.,curtismorrison,F,P,1,refuse and anti-immigration is an exaggeration. Check Biden immigration policies,0,0.0,0.6302202674
733,T4,502037,"Just found out that an Assistant US Attorney who defends @StateDept in lawsuits filed by immigrant families works in the criminal division, and not the civil division. Feels sketch.",curtismorrison,O,A,1,,1,,0.7311262461
734,T4,151019,Let's Talk Immigration - E74 https://t.co/zBVjGuAdqu,curtismorrison,T,P,1,,0,1.0,0.3050362852
735,T4,518897,"Reflecting on how 3 months of the ""Year of the Immigrant Visa"" have gone by but @StateDept has yet to announce it exists, except to AILA.
https://t.co/FBzcVLPJdr https://t.co/Q91LRlQaRE",curtismorrison,T,P,1,,0,1.0,0.6438801355
736,T2,1169724,Priti reveals plans to target eco-mob and asylum fix in 2022 https://t.co/aTsPKnoMEz,Daily_Express,T,U,0,,0,1.0,0.5919258645
737,T2,1118538,"Migrant crossings 2021 data in full as Channel trips increase threefold
https://t.co/yIlCXDrjhv https://t.co/QQNslEFqth",Daily_Express,T,U,0,,0,1.0,0.7031286891
738,T2,1175217,"Migrant crisis: 'Large stone unturned' in fight against smugglers – Boris told to act

https://t.co/5gZOCUNQnf https://t.co/MrZnJPkegO",Daily_Express,T,U,0,,0,1.0,0.5400608552
739,T2,1173830,Not this hard on terrorists or migrant traffickers' Macron brutally shut down over curbs https://t.co/vcmRI1RBO0,Daily_Express,E,A,0,,0,0.0,0.4969035301
740,T2,1248007,"Plea to ‘toughen asylum laws’ after more migrants attempt to cross Channel

https://t.co/c7Eevmo5U2",Daily_Express,T,A,0,,0,1.0,0.436505386
741,T3,1580662,"🚨EXCLUSIVE🚨 from @JennieSTaer &amp; @DRJasonPiccolo 

ICE Memo Calls For 'Rapidly Releasing' Illegal Immigrants Ahead Of Trump-Era Border Policy's End

https://t.co/XSozIJFEEG",DailyCaller,T,U,1,,0,1.0,0.6213748496
742,T4,412656,"Blue State Public Official Reveals How Much Taxpayers Are Paying for 'Unsustainable' Illegal Immigrant Policies
https://t.co/AD9XiOr08P",DailyCaller,E,A,1,,0,0.0,0.7821883414
743,T4,241193,"National Guard in Texas takes on illegal immigrants

 https://t.co/LQ8HEuWbGs",DailyCaller,T,A,1,,0,1.0,0.7660250333
744,T3,1526014,Biden’s admin is restricting asylum access ahead of Title 42’s end https://t.co/D8PZRHB9FD,DailyCaller,T,U,1,,0,1.0,0.661427859
745,T4,456895,"Dem Mayor Defended Shielding Illegal Immigrants From ICE Days After Laken Riley Murder, Emails Show https://t.co/cXaCHDwLkn",DailyCaller,T,A,1,,0,1.0,0.6385229873
746,T4,532675,"@ReichlinMelnick For sure, I'm just saying there's nothing surprising in their tweet. The program is targeted at four Florida heavy immigrant groups",DanielDiMartino,T,U,1,,0,1.0,0.6236028899
747,T4,519375,@ColopyC @reason @cesarbaezc This is one of the very few agencies that is fully self funded. The vetting and processing of his application was paid by other legal immigrants paying our fees. I wish that wasn't the case and this parole process had a fee but it's not taxpayer dollars allocated by congress.,DanielDiMartino,T,U,1,,0,1.0,0.7220360514
748,T4,518999,@MrNOVApolitico Agree and that is the same case for any immigrant from these countries and many others. That's why vetting and requiring sponsors is critical for any process. And focusing additional vetting on young unmarried men who are the overwhelming majority of criminals.,DanielDiMartino,E,U,1,,0,0.0,0.6870325355
749,T2,1049529,At this pace there will be more people *emigrating* from America than immigrating here. This is terrible news for the shining city on a hill.,DanielDiMartino,F,U,1,,0,0.0,0.5719116448
750,T3,1584522,"Imagine: Nuclear power, high skilled immigration, permitting reform, liberalization of zoning and housing regulations... America BOOMS",DanielDiMartino,O,I,1,,1,,0.5074911679
751,T4,576358,@ReichlinMelnick They're running out of people and will eventually be totally depopulated due to low fertility and emigration.,DanielDiMartino,E,A,0,,0,0.0,0.4733887927
752,T4,634811,"😂😂😂

#LiftTheBan

Peter is seeking asylum in the UK

Peter is from the Sudan 'Say no more'

Give Peter a Christian forename rather then a Muslim name!!!

I have not seen too many Sudanese Christians make to the UK alive!!! https://t.co/FSAQpAARP0",dave24144975,O,P,0,,1,,0.4080550574
753,T2,1286913,"😡😡😡

Afghan asylum seeker Rasuili Zubaidullah

Drugged, raped &amp; suffocated 13-year-old schoolgirl Leonie Walner.

Fled hundreds of miles to Dunkirk evading a pan-European manhunt before boarding a trafficker's boat to Britain &amp; then onto a luxury hotel!
https://t.co/Kl41zTSjTF https://t.co/NhcE0qyZZT",dave24144975,T,A,0,,0,1.0,0.7567069002
754,T4,206349,"illegally trafficking immigrant boats'

The captain of an English cargo ship has accused the French navy of 'illegally trafficking immigrant boats' across the Channel to Dover.

In damning radio messages, the angry senior officer complained to the French coastguard when his vessel, Scot Pioneer, was stopped from entering Dunkirk harbour as navy vessels, including a warship, guided the traffickers' boats around his ship.

In response, the coastguard informed him that there was an 'arrangement' between the London and Paris governments for the French navy to escort migrant boats towards Britain.

The captain begins his protest by radioing the French coastguard with the words: 'I would like to report what is an illegal operation in your waters.

'This morning we witnessed a French government vessel and a French navy warship escort a boat-load of illegal immigrants across the Channel to the midway point where they handed them over to another [Border Force] ship out of Dover. It has now arrived there.",dave24144975,F,A,0,,0,0.0,0.8242443939
755,T2,1109217,"""It has also been reported separately that al-Swealmeen attended an unnamed Liverpool mosque on a frequent basis during Ramadan last year. All of this points towards an insincere religious conversion designed to bolster al-Swealmeen’s long-standing asylum claim."" https://t.co/X9DDwkOJyD",dave24144975,F,A,0,,0,0.0,0.5325631604
756,T2,1301322,"Not just the BBC....

It would seem both right and left wing media outlets and politicians alike are in favour of uncontrolled immigration...

Politicians/media championing illegals/asylum seekers to the detriment of their own people! https://t.co/ja4F6oes5D",dave24144975,E,A,1,,0,0.0,0.5731043548
757,T2,1185529,"Dorset Council is looking for people from all backgrounds (can be married, single or in a partnership, from all ethnic groups and cultures)

""The majority of the young people arriving as asylum seekers are 16 or 17 years old.""

16/17 years old translated into asylum years = 18+ https://t.co/2CDxrzNoFw",dave24144975,E,A,0,,0,0.0,0.711043183
758,T2,1100955,"@diane_longstaff 147 staggering, and that is just the one's with asylum seekers in...",dave24144975,O,A,0,,1,,0.5862112299
759,T2,1128723,"😐😐

Already booked out for 2022!

It's not refugees it's asylum seekers, those one's which the government expects to be arriving here on a daily basis.

Reservations for the historic hotel currently being used to house asylum seekers cannot be made for almost another year.

R/T https://t.co/KaBblSlEow",dave24144975,O,A,0,,1,,0.6946438239
760,T2,1296968,"It seems everyone is on board with allowing economic/illegal migrants being given the right to work. 

Soon another pool of labour will be at the employers disposal more competition for jobs, I can guarantee many of these people will being fast-tracked into work!

It will happen! https://t.co/eAw1hS7UOy",dave24144975,O,A,1,,1,,0.389006931
761,T2,1092409,"Contingency accommodation

An MP has objected to a hotel in Barrow being used to house asylum seekers amid ‘community tensions’ &amp; recent ‘far-right’ activity in the town.

I would be more concerned about the people who are going to be living there, rather than people objecting! https://t.co/t4Kah6wnTa",dave24144975,T,A,0,,0,1.0,0.422196034
762,T2,1170438,"Headline 'Refugee'

When along she is an asylum seeker who like came here illegally...

 I managed to get a rare Sanctuary Scholarship to study an MSc in NGO and Development Management at the University of East London (UEL)...
https://t.co/k5DinqN3zj",dave24144975,T,U,0,,0,1.0,0.6614149555
763,T2,1307190,"Cllr Arooj Shah, Leader of Oldham Council, said: ""asylum seekers have now arrived safely at a hotel in Oldham.""

I know that Oldhamers will be kind &amp; support these people, many of whom will not understand English &amp; who have had a very difficult experience before arriving here. https://t.co/RSk07Yomid",dave24144975,T,P,0,,0,1.0,0.4390972259
764,T2,1340527,"🙄🙄🙄🙄

BBC headline image is of a young child not a TEEN!!!

Housing and support is needed for unaccompanied asylum-seeking children in Cornwall.

Cornwall Council is appealing to people who may be able to help house the 16 and 17 year olds.

So young men!!! https://t.co/8vSwcEyhqs",dave24144975,O,U,0,Mia coded the stance as Anti-immigration,1,,0.6354056885
765,T4,672006,"Check out my latest video and please sub to the channel

Broken Britain Asylum Seeker Crime #uk #asylumseekers #crime #Brokenbritain #video  

https://t.co/cUQaFsz1Wc",dave24144975,E,A,0,,0,0.0,0.2906958128
766,T2,1171507,"🏴󠁧󠁢󠁳󠁣󠁴󠁿🏴󠁧󠁢󠁳󠁣󠁴󠁿🏴󠁧󠁢󠁳󠁣󠁴󠁿

Some of the headlines from Scotland today!

A refugee wanting relatives to be allowed join her via family reuinifcation, a lawyer is on hand to help! 

Not enough refugees/asylum seekers in Scotland!

Another Afghan refugee/asylum seeker story😴😴😴

Links posted... https://t.co/aRt8hvsDHO",dave24144975,T,P,0,,0,1.0,0.4746281306
767,T4,251909,What’s the cost of looking after all the illegals in this country and their family ?,DaveDyallen72,O,A,1,,1,,0.4789480868
768,T3,1571283,@NickFarmer3 He will be here soon claiming asylum,DaveDyallen72,O,U,1,,1,,0.4443507689
769,T4,251935,@SkyNews What’s the cost of looking after all the illegals in this country and their family ?,DaveDyallen72,O,A,1,,1,,0.5544319707
770,T2,1308652,@DavidPoulden Immigrant,DaveDyallen72,O,U,1,,1,,0.3791947347
771,T3,1510094,@markmaycot Deportation is what’s needed not a barge,DaveDyallen72,O,A,1,,1,,0.3388240081
772,T2,1292426,"It also requires them to have at least 1 year of experience in the occupation, which it doesn't do for any other job. Yet despite requiring 1 year experience for immigrants, it won't automatically let households list that as a requirement for employment in job ads to US workers.",David_J_Bier,T,U,1,,0,1.0,0.7183320254
773,T2,1368121,"Also, a reminder that the only reason that this is happening is because America is the only country in the world that discriminates among employment-based green card applicants based on their birthplace. https://t.co/QpVxSTwz6m",David_J_Bier,T,I,1,,0,1.0,0.6173738462
774,T4,80427,Don't listen to CBO scores on immigration. They are worse than useless. They're more misleading than anything published by the most anti-immigrant org out there. https://t.co/pJlhtstMYO https://t.co/VCE4crMIIX,David_J_Bier,O,P,1,,1,,0.4228320956
775,T2,1347525,"It's impossible for me to tell how rigorously it's enforced, but why does DOL discriminate against live-in domestic help in permanent labor certifications? It seems like one of the best ways to get a green card for an unskilled woman, yet DOL requires added justification.",David_J_Bier,E,U,1,,0,0.0,0.3148002345
776,T2,1347518,"Reading the USCIS Policy Manual will remind you how much money is being wasted on fine distinctions of no importance whatsoever, utterly useless information that someone needs to be paid to learn just so that a few thousand immigrants can live and work in peace.",David_J_Bier,E,A,1,,0,0.0,0.3356030354
777,T2,1290659,"I'm not asking for more, but I honestly don't get it. 200 immigrants being put in MPP won't deter anyone, and since that's the only reason for implementing MPP, it imposes gratuitous cruelties on people for absolutely no reason.  https://t.co/kRWXqJkB4x",David_J_Bier,E,P,1,,0,0.0,0.6364452704
778,T4,75000,Driver charged in fatal car crash with @SenCortezMasto aide identified as illegal immigrant https://t.co/7an6FZi7AW https://t.co/7an6FZi7AW,dcexaminer,T,I,1,,0,1.0,0.6804389986
779,T4,367313,WATCH: Housing program for illegal immigrants could affect market https://t.co/w6Vwx2rKHO https://t.co/w6Vwx2rKHO,dcexaminer,O,A,1,,1,,0.5946927857
780,T4,302411,#EXCLUSIVE — Illegal immigrants would be banned from boarding commercial flights under GOP bill https://t.co/Jq3w1siLIN https://t.co/656GqNZsgY,dcexaminer,T,A,1,,0,1.0,
781,T4,739161,Denver plan to slash police and fire department budgets to pay for migrant crisis clears first hurdle https://t.co/OeIpFZw3XY https://t.co/OeIpFZw3XY,dcexaminer,T,A,1,,0,1.0,0.7042259644
782,T4,596360,Colorado county distances from Denver ‘sanctuary city’ policies by threatening busing companies https://t.co/SkXyYcicsH https://t.co/SkXyYcicsH,dcexaminer,T,A,1,,0,1.0,0.579607382
783,T2,1172434,"The Justice Department argues that the Migrant Protection program, known as ""Remain in Mexico,"" actually ""exposes migrants to unacceptable risks,""

After several appeals and lower court stays, they are now asking the Supreme Court to take up the case.

 https://t.co/CDZe57ONQr",dcexaminer,T,I,1,,0,1.0,0.836648826
784,T4,10321,Abbott urged to create Texas homeland security office to address border crisis https://t.co/hG023sl19s,dcexaminer,T,A,1,,0,1.0,0.7346049966
785,T2,1158260,"The Justice Department argues that the Migrant Protection program, known as ""Remain in Mexico,"" actually ""exposes migrants to unacceptable risks,""

After several appeals and lower court stays, they are now asking the Supreme Court to take up the case.

 https://t.co/XKOvczjZ1U",dcexaminer,T,P,1,,0,1.0,0.8349442764
786,T4,264967,Biden’s border sees nearly half a million immigrant children arrive without a parent https://t.co/EqIoytlM1N https://t.co/EqIoytlM1N,dcexaminer,T,A,1,,0,1.0,0.8402281877
787,T3,1574487,"Gov @GregAbbott_TX showed how the state is seeking to temper a rush of migrants at the southern border late Monday evening, posting a video revealing barbed wiring strung across gaps along the border.

https://t.co/MAeirsNq4t",dcexaminer,T,A,1,,0,1.0,0.5887473936
788,T4,114033,"Economic contributions from immigrants released into US from border may come with strings attached, experts warn https://t.co/YqEk4K8dfZ https://t.co/YqEk4K8dfZ",dcexaminer,O,A,1,,1,,0.5591298867
789,T4,529269,Opposition widespread to giving illegal immigrants a child tax credit https://t.co/KXVeALs0TQ https://t.co/KXVeALs0TQ,dcexaminer,E,A,1,,0,0.0,0.4896942931
790,T4,487043,"DeSantis suspects 'illegal parole program' doesn't communicate with states on immigrants arrival

READ: https://t.co/pK1wRvqbfK

#Ron #DeSantis #RonDeSantis #Immigrants #Border #BorderCrisis #Migrants #Left #Democrat #Republicans #US #Politics #News #Viralvideo #Explore https://t.co/NUOPfjesYF",dcexaminer,T,A,1,,0,1.0,0.7266197374
791,T2,1434162,"WATCH: Gov @GregAbbott_TX receives National Border Patrol Council endorsement

https://t.co/MZJsxphoOn",dcexaminer,T,U,1,stance inconsistency: Sam coded as Anti-immigration,0,1.0,0.599951452
792,T4,79320,Driver charged in fatal car crash with @SenCortezMasto aide identified as illegal immigrant https://t.co/e5gtg9wLxr https://t.co/e5gtg9wLxr,dcexaminer,T,U,1,,0,1.0,0.6734263839
793,T4,610123,"Facing a migrant crisis and $45M in cuts, Denver looking to spend $30M on stagehands https://t.co/plm7BtfjHA https://t.co/plm7BtfjHA",dcexaminer,T,U,1,,0,1.0,0.6636474443
794,T4,82193,"@RepJasonSmith Former President Donald Trump, still the leader of the GOP, has not only been attacking the bipartisan immigration bill publicly; he is reportedly lobbying Republican lawmakers to kill it. So when President Joe Biden went befor",dean_dcdewitt,T,I,1,Politico source for trump attacking immigration billss,0,1.0,0.6751625904
795,T3,1553689,"@RepTenney Fact - President Biden inherited an immigration system in tatters. The Trump administration cut off legal pathways to citizenship, leaving would-be migrants with fewer lawful methods of entering the country.",dean_dcdewitt,E,P,1,,0,0.0,0.7707944565
796,T4,556592,"@FoxNews Most sanctuary city policies are decided not by Republicans or Democrats, but on a local level, and usually depend on the resources available to local law enforcement. A helpful example is Pennsylvania.",dean_dcdewitt,T,U,1,Neutral claim,0,1.0,0.4145415352
797,T2,1400719,@JohnCornyn @TexasTribune You need to be working on immigration reform instead of tweeting!,dean_dcdewitt,O,U,1,,1,,0.4107620342
798,T4,21603,"@RepBoebert The same MAGA Republicans who say that Congress should not approve aid to our allies until we address the border crisis…

Are the same people who just recently, under the direction of Trump, killed a bipartisan immigration bill endorsed by the Border Patrol Union",dean_dcdewitt,E,A,1,,0,0.0,0.8525967662
799,T2,1313909,"“Italy saw more than 67,000 migrants disembark in 2021, to which were added 440 new illegal immigrants yesterday”",DFallamhain,T,U,0,,0,1.0,0.890897573
800,T2,1149013,"“Shock in the Czech Republic: an 18-year-old girl raped in the middle of the street and a woman stabbed by the same man on New Year's Eve, a 20-year-old migrant from Afghanistan arrested”

@HMcEntee",DFallamhain,T,U,0,,0,1.0,0.6838309275
801,T2,1304493,"EU Observer
Denmark's former immigration minister Inger Støjberg was sentenced to 60 days in jail for separating married asylum seekers.
Then we read she issued an order “to separate married and cohabiting couples, if one of the two was deemed a MINOR.”

https://t.co/JClZ8MEruc",DFallamhain,T,U,0,,0,1.0,0.8725723622
802,T2,1156291,"@greenshame I’m not going to get too excited about this. If the illegal immigrant has learned to splutter out ‘I seek asylum’, they will be allowed to remain.

“Four single-person cells” wouldn’t begin to solve the problem.",DFallamhain,E,A,0,,0,0.0,0.5963259658
803,T4,737645,"“So far this year, €214m has been spent on private accommodation for asylum seekers, compared to a figure of €627m for all of 2023.”
“costs on average €76 per night”

https://t.co/tNHXakJvSe",DFallamhain,NR,NR,NR,NR,0,,0.8774249952
