origin,Unnamed: 0,text,author.userName,misinformation,stance,isUSRelated,notes,opinion_label,true_label
T4,803226,"🎙️ PODCAST ALERT 🎙️

Meet Alphonse, a UNHCR staff member and a champion of refugee inclusion across the 🌎.

Dive into his latest project in Brussels where he brings together refugees with local authorities to shape policies that impact them.

Tune in now: https://t.co/Fr25Guux5r https://t.co/DT0l4VFXKE",Refugees_EU,T,P,0,,0,1
T4,720967,"Calling all refugee-led organizations! 

We want to hear your forward-thinking ideas to bring lasting positive change. ✨

Apply now to UNHCR’s Refugee-led Innovation Fund: https://t.co/75mMoDu8lt https://t.co/F0MItr2UnD",Refugees_EU,T,P,0,,0,1
T3,1532332,"Whoever they may be.
Wherever they may come from.

 #RefugeesWelcome https://t.co/SuhfT6QGyp",Refugees_EU,O,P,1,,1,
T2,1269679,". @EspacioMigrante &amp; @HaitianBridge spoke with migrants in Tijuana on the impact #COVID19 has had on their lives.
What did they find? Non-Spanish speaking &amp; Black migrants faced distinct barriers to employment, education, healthcare, &amp; housing.
Read more:
https://t.co/xoD17eSsGK",RefugeesIntl,T,P,0,,0,1
T2,1283017,"The number of people displaced worldwide is higher than ever before. 

We envision a world where everyone can live in safety &amp; dignity. But we can’t do this alone. 

Become a monthly donor &amp; you can support our refugee advocacy all year round.
https://t.co/NlNnAXdOK0",RefugeesIntl,T,P,0,,0,1
T2,1162238,"“For migrants in our survey, document-based discrimination, anti-immigrant hostility, &amp; racism were an inextricable part of their daily lives during the pandemic.”
 
New report by @EspacioMigrante &amp; @HaitianBridge on the situation facing people in Tijuana
https://t.co/xoD17eSsGK",RefugeesIntl,E,P,1,,0,0
T2,1110427,"“Our work is based on gratitude &amp; positive energy, &amp; our efforts are centered on playing the game of life &amp; allowing our true voice to illuminate the path for others”

@ICasabierta is helping LGBTQ+ migrants find security &amp; safety in Costa Rica. Learn more
https://t.co/JQGjStxTnw",RefugeesIntl,T,P,0,,0,1
T2,1061057,"“For migrants in our survey, document-based discrimination, anti-immigrant hostility, &amp; racism were an inextricable part of their daily lives during the pandemic.”
 
New report by @EspacioMigrante &amp; @HaitianBridge on the situation facing people in Tijuana
https://t.co/xoD17eSsGK",RefugeesIntl,T,P,1,,0,1
T2,1169532,"“My problem is that right now I don’t have any documents. But I want to work. I can’t find a job. I don’t have documents to find a job.”
 
—Man from Ghana
 
Read more about the situation facing migrants &amp; displaced people in Tijuana:
https://t.co/xoD17eSsGK",RefugeesIntl,T,P,0,,0,1
T2,1214134,". @EspacioMigrante &amp; @HaitianBridge spoke with migrants in Tijuana on the impact #COVID19 has had on their lives.

What did they find? Non-Spanish speaking &amp; Black migrants faced distinct barriers to employment, education, healthcare, &amp; housing.

Read more
https://t.co/xoD17eSsGK",RefugeesIntl,T,P,1,,0,1
T2,1087485,"Until 2019, #Lebanon was considered a middle-income country.
 
Today, the country has sunk into destitution.
 
@SaharAtrache lays a path forward for everyone, including #refugees. Read more:
https://t.co/Wd2ixQyITN",RefugeesIntl,NR,NR,NR,NR,0,
T2,1267036,"In 2022, we'll continue to build a more welcoming world. Your gift will help us:
💙 Advance the rights of displaced people worldwide
💙 Restore U.S. leadership on asylum &amp; refugee resettlement
💙 Push for equitable access to the COVID19 vaccine
Give today
https://t.co/NlNnAXdOK0",RefugeesIntl,T,P,1,,0,1
T2,1431311,Five Texas national guard troops have died at the border from suicide since Abbott deployed them.,ReichlinMelnick,T,A,1,,0,1
T2,1295803,"O.A. was taken into a room by two Border Patrol agents. She told them she wanted to seek asylum. The agents said that her daughter was going to be taken away from her.

She began begging them not to, even saying she'd give up her asylum claim. They screamed at her to be quiet. https://t.co/2pfcCykUe5",ReichlinMelnick,E,P,1,,0,0
T2,1457447,Oh wow. All non-detained immigration court cases where individuals are not represented by a lawyer have been postponed through the end of January due to the spread of Omicron. https://t.co/KZFIbtug9Y,ReichlinMelnick,T,U,1,,0,1
T3,1581122,"That's not to say that there's no difference between the Biden and Trump administrations. 

Under Trump, the transit ban applied to everyone. Under Biden, migrants who win an appointment lottery through CBP One app lottery will be exempt from the new ""rebuttable presumption.""",ReichlinMelnick,T,I,1,,0,1
T2,1414282,Really big immigration case at the Supreme Court coming on Tuesday that will further clarify whether or not the government may lock immigrants in ICE jails for over six months without ever allowing them to see a judge and ask for bail.,ReichlinMelnick,T,P,1,,0,1
T3,1494180,"If no exceptions apply you can still ""rebut"" the presumption of asylum ineligibility in ""exceptionally compelling circumstances."" 3 things count automatically:

- ""Acute medical emergency""
- ""Imminent and extreme threat to life and safety.""
- Victim of severe form of trafficking. https://t.co/9a0Ty0uv7K",ReichlinMelnick,T,P,1,,0,1
T2,1442106,"Conditions like this are totally unacceptable, just as they were under Obama in 2014 and Trump in 2019.

The Border Patrol has had years to prepare for events like this. They haven't, and that's the failure. The agency is unable to treat people humanely on a consistent basis.",ReichlinMelnick,O,P,1,,1,
T3,1558659,Weird choice to call DACA recipients (who by definition have been in the US  since at least June 2007) “migrants.”,ReichlinMelnick,O,P,1,,1,
T2,1246859,"The factual errors continue in paragraph 5, though this one is more semantic disagreement.

Asylum seekers do not ""often"" miss court. Statistics show that they appear in court over 80% of the time, and I don't think that counts as ""often"" missing court. https://t.co/2hKXnZqYeo",ReichlinMelnick,T,P,1,,0,1
T3,1491504,"Importantly, this new asylum restriction also applies to anyone who isn't taken into custody at the border and who later applies for asylum at USCIS—what's know as the ""affirmative asylum"" process.

https://t.co/nCJsxwoHtV",ReichlinMelnick,T,I,1,,0,1
T4,238043,"Since today is Tax day, check out @immcouncil's fact sheet on the Individual Taxpayer Identification Number, which millions of undocumented immigrants use to pay taxes each year. https://t.co/rm68kQOjf9",ReichlinMelnick,O,P,1,,1,
T3,1495585,"Today has been a pretty consequential day on immigration. So let's go through everything which has happened in the last 24 hours, starting with this morning's big news: the Biden administration's finalized new asylum restriction, first introduced as a proposed rule in February.",ReichlinMelnick,O,U,1,,1,
T3,1493887,"So what does this all mean in normal person?

Unless you get an appointment to seek asylum at a port of entry, if you cross the border you're probably not going to be eligible to seek asylum.

That's really it at the core. Get an appointment? No problem. No appointment? Problem.",ReichlinMelnick,T,U,1,,0,1
T2,1246864,"Further inaccuracies in paragraph 4 (though a very common one)—MPP had nothing to do with ""asylum applicants.""

People put into MPP were/are not asked if they want to seek asylum, and are not permitted to apply for asylum until AFTER they are sent back to Mexico. https://t.co/ZI8RpQ0yvp",ReichlinMelnick,T,U,0,Article report,0,1
T2,1116199,"Per @YaelSchacher's court observations, ""among the 82 MPP enrollees who had hearings on Monday and Tuesday, only five had legal counsel.""

MPP 2.0 suffers from the exact same problems of MPP 1.0; it's nearly impossible for migrants to get US lawyers from Mexico.",ReichlinMelnick,T,P,1,,0,1
T4,669871,"Obviously they exist. ""Overwhelming majority"" doesn't mean ""all,"" and the rest of the fentanyl smugglers tend to be either people on green cards or Mexican nationals with visas or border crossing cards. And a very small % is brought across between ports. https://t.co/fdmtxF6lBZ",ReichlinMelnick,T,P,1,,0,1
T4,316622,"It's already illegal for undocumented immigrants to vote in federal elections. It's so illegal that it's a felony, a ground of deportation, AND a near-permanent ban to receiving any future immigration benefit.",ReichlinMelnick,T,U,1,,0,1
T2,1261511,"Second, here's an (also paid!) summer internship opportunity for law students to work with our fantastic legal team! Help us sue the government, protect immigrant rights, uncover government secrets, and more!

Feel free to check them out!

https://t.co/D8DuetwZdD",ReichlinMelnick,O,P,1,,1,
T2,1366899,Very important to note that visa recapture and green card provisions are NOT covered in this opinion.,ReichlinMelnick,O,A,0,,1,
T2,1375371,"On that last point, CBP and USCIS likely don't have a plan for how to practically arrange that volume of non-refoulment interviews.

My guess? A suspiciously high number of people will be ""waive"" the interview—or at least that's what Border Patrol will say.",ReichlinMelnick,E,A,1,,0,0
T2,1484944,"The cherry on top is that the article he links to about his prior ""reporting"" says literally nothing about that point. It's an article about one guy from Afghanistan who entered in 2008 and pled guilty in 2014 to immigration fraud for lying about connections to a terror group.",ReichlinMelnick,E,A,1,,0,0
T4,133704,"Even if the true number is closer to $21.3 million, with 855,000-900,000 undocumented immigrants living in Florida, that would be an average cost of $23-$25 per person. That's pretty low!",ReichlinMelnick,E,U,1,,0,0
T4,52018,"The last time the House voted on HR2, it got 219 votes. This time around, after they stripped out nationwide E-Verify portion and added $9.5 billion for Texas, Florida, and other states cracking down on immigrants (while giving $0 to fix the asylum system), it only got 215 votes.",ReichlinMelnick,T,A,1,,0,1
T2,1290445,"Notably, because the wall is built well onto US territory, it will have literally zero impact on people seeking asylum, who just come up to the base of the wall and wait for Border Patrol to let them in.

You can't wall off the right to seek asylum.",ReichlinMelnick,O,P,1,,1,
T3,1552692,"Oh my GOD. One of the victims @GregAbbott_TX called an “illegal immigrant” had a green card! She was a 21-year-old woman originally from Honduras who won asylum (the AS6 code means “asylee”) and adjusted to lawful permanent resident status.

Her husband wants the truth out there.",ReichlinMelnick,E,U,1,,0,0
T2,1157706,"MPP returns to San Diego, the place where it all began just under 3 years ago. A major step backwards for the rule of law and for the rights of people to seek asylum in safety.",ReichlinMelnick,T,P,1,,0,1
T4,332250,"Well done, @ICEgov. It’s a shame these agents have to do triple the work and risk their safety because #NYC won’t notify ICE, voluntarily turn them over or comply with detainer requests. Left wing politicians care more about protecting illegal immigrant criminals than the safety of their citizens.

https://t.co/YxMbth6PHg",RepMalliotakis,O,A,1,,1,
T2,1435036,"Because 80% of that fentanyl killing Americans is coming from the Southern Border that they not only refuse to secure, but purposely keep wide open:

https://t.co/pK92JjI3Vt",RepMalliotakis,E,A,1,,0,0
T4,245609,"What about the war the drug cartels have waged on America with the invasion of illegal immigrants, convicted criminals and gang members entering our open borders &amp; killing well over 100k Americans annually by fentanyl, murder and drunk driving? https://t.co/mcG4uDgspk",RepMalliotakis,E,A,1,,0,0
T4,467683,"The sad thing is the NYPD was FORCED by NYC Council’s ludicrous laws to release these individuals after their arrest. Warped NYC Democrats prefer that illegal immigrant criminals continue roaming our streets. Thankful to @ICEgov officers who now have to go find them because NYC refuses to comply with detainer requests. Also, these criminals were stopped at the border, but Biden Administration policies force @CBP to release them into our country. Asinine!",RepMalliotakis,O,A,1,,1,
T2,1464795,"Under Biden &amp; one party rule, America is suffering:

➡️ Dismal jobs report
➡️ Declining labor participation
➡️ Declining wages
➡️ Gas up 58%
➡️ Highest inflation in 40 yrs 
➡️ Record illegal immigration
➡️ Skyrocketing crime in Dem-run cities

They thought we wouldn’t notice.",RepMalliotakis,O,A,1,,1,
T4,493320,"Every day, members of our community are becoming victims of criminal acts perpetrated by illegal immigrants who exploit Albany Democrats' ineffective bail reform.

This disastrous policy continues to allow violent & dangerous criminals back onto our streets.

It's time to secure our borders & end bail reform.",RepTenney,E,A,1,,0,0
T2,1414620,"We are 10 days away from the one-year anniversary of #BidensBorderPolicies taking effect. 
 
In one year, 1.7 million illegal immigrants, including criminals &amp; some with connections to terror groups, have taken advantage of massive gaps in our national security. #SecureTheBorder",RepTenney,E,A,1,,0,0
T3,1501452,"Downstate Democrat politicians campaign on pro-sanctuary city policies, but they don't actually want to deal with their consequences. Instead of busing migrants across New York, Mayor Adams should end NYC's sanctuary city policies and enforce the law. https://t.co/LTCRvdUHlQ",RepTenney,O,A,1,,1,
T2,1472762,Progressives in Congress care more about spying on your bank account than securing our border.,RepTenney,O,A,1,,1,
T4,374040,"Illegal immigrants flocking to our country know that they will be let in under Joe Biden's weak border policies! 
https://t.co/9BdO9yjCO1",RepTenney,E,A,1,,0,0
T3,1579876,"US border agents in El Paso, Texas, urged hundreds of migrants amassing on city streets to surrender to authorities as illegal crossings rose in the run-up to the end of COVID border restrictions known as Title 42 later this week https://t.co/6F3xPGdCI4 https://t.co/q0gJ12oU5t",Reuters,T,A,1,,0,1
T2,1463652,"Fans of Serbian tennis star Novak Djokovic danced and waved the Serbian flag as a priest led prayers marking Orthodox Christmas, outside an Australian immigration hotel https://t.co/Ldaf2Eoi0q https://t.co/ZE3slttcOl",Reuters,T,P,0,,0,1
T2,1114425,U.S. sends 119 Cuban migrants home as growing number take to sea https://t.co/BCOXOE1QxL https://t.co/0XAOS7ZcXi,Reuters,T,U,1,The tweet simply reports the event without expressing an opinion or stance on whether this action is positive or negative.,0,1
T2,1146248,UK officials expect deal on Channel migrant crisis after French election - The Times https://t.co/K2wzRbU2V6 https://t.co/itNGugjMX2,Reuters,T,U,0,"It reports on expected diplomatic developments without suggesting approval, disapproval, or concern over the migrant crisis or the anticipated deal.",0,1
T4,755183,UK's Rwanda asylum plan to be debated on April 22 https://t.co/MCFocJYC0h https://t.co/EDyETFxmcj,Reuters,T,I,0,,0,1
T2,1472818,World number one Novak Djokovic spent a second day in immigration detention in Australia as his lawyers battled to secure his release to play in the #AusOpen and be exempt from strict COVID-19 vaccination requirements https://t.co/S0xxiR2zSo https://t.co/HUY0Qh0dMO,Reuters,T,I,0,,0,1
T2,1297134,"For refugees, migrants, asylum-seekers, as well as people afflicted by natural disasters or other events that put them out of reach of government help, COVAX created a Humanitarian Buffer – a last-resort reserve of shots to be administered by humanitarian groups 5/7 https://t.co/VUcaXaq9Fg",Reuters,T,I,0,,0,1
T2,1166962,Charity boat with 440 migrants to dock in Italy https://t.co/2HRGlGqI8e https://t.co/9z3BMSiRmh,Reuters,T,U,0,Article title,0,1
T2,1268744,UN: Air strike kills three in Eritrean refugee camp in Ethiopia https://t.co/PnLwnVBXUI https://t.co/iLdC6ek6KZ,Reuters,T,U,0,Article title,0,1
T2,1087519,"Djokovic, the No. 1 tennis star in the world, was filing an injunction to prevent his deportation, the source said https://t.co/i1rGwBWpR0",Reuters,T,U,0,,0,1
T2,1475955,Canada resists pressure to drop vaccine mandate for cross-border truckers https://t.co/nvplHEUdCL https://t.co/gQuYCLcjOh,Reuters,T,U,0,,0,1
T2,1138079,"4,400 migrants lost at sea bound for Spain in 2021, double previous year https://t.co/2CnMekUQyD https://t.co/ixvbKwSwax",Reuters,T,P,0,,0,1
T3,1553555,Australia proposed overhauling its immigration system to speed up getting highly skilled workers into the country and smoothening the path to permanent residency https://t.co/RxXwOLNVYn,Reuters,T,U,0,,0,1
T4,500081,"Donald Trump called immigrants illegally in the United States ‘animals’ and spoke of chaos consuming America if he did not win the Nov. 5 presidential election, as he campaigned in Michigan and Wisconsin https://t.co/5Civhpmn84 https://t.co/INFfTQv4HT",Reuters,T,A,1,,0,1
T2,1135311,UK targets scientific ways to determine asylum seekers' age https://t.co/yySw9xcgGr https://t.co/0XODzMUzEB,Reuters,T,U,0,,0,1
T4,495971,"Donald Trump called immigrants who were illegally in the United States ‘animals’ and ‘not human’ in a speech in Michigan, as he intensified his focus on border issues with incendiary rhetoric on his campaign trail https://t.co/5Civhpmn84 https://t.co/8ZZ5AXBFrT",Reuters,E,P,1,Mia coded the stance as Anti-immigration,0,0
T2,1308106,"Hundreds of students and staff of the Afghanistan National Institute of Music and their relatives were granted asylum in Portugal, where they hope to settle and pursue their artistic dreams https://t.co/S0NZCpHNm3 https://t.co/kZBuBkvr0v",Reuters,T,P,0,,0,1
T2,1233988,"Nearly 150 murders and disappearances in connection with a land conflict have convulsed Honduras' Aguán Valley since 2008, when violence first intensified in that northern corner of the country. It has stoked a migrant flight to the U.S. https://t.co/eqsmoIPgtJ @gottesdiener https://t.co/DJjveOpn9N",Reuters,T,U,1,,0,1
T3,1565143,"@TorontoStar ""city’s overall homeless population has been soaring, with an increase in the last year of roughly 1,300, to a total of more than 10,800 in Feb""

A John Tory legacy 
Declaration: Sanctuary city! 

Trudeau says economy doing well. Carbon and grocery rebates are working 🤓",Rex66992401,O,A,0,,1,
T4,563459,"@CP24 ""Toronto man facing 8 alleged sex assaults charges at east-end restaurant""

No name. No description.
Once more 

May we guess? 
Non-white 
New migrant. 
Name:
Muhammed, Muhamad, Mohammad, Mohammed, Mahammad, Mahammed, Mohamad, Mohamed, Mehmet?
🤓",Rex66992401,E,A,0,,0,0
T4,557043,"@jihadwatchRS ""Italy: Muslim migrants savagely beat another migrant for attending church""

It will come here 🇨🇦🇺🇲
Just a matter of time 
Follow the Palestinian Protests, just the beginning 
.",Rex66992401,E,A,1,,0,0
T4,277232,"@insauga ""Knife pulled as suspect tries to flee Halton Hills Walmart with stolen groceries""

Cultural enrichment? 
Non white?
Illegal Migrant? 

Do tell 🤓
.",Rex66992401,F,A,0,,0,0
T2,1220198,".
Over 85% fully vaxxed, but, it's the unvaxxed fault for spreading the virus? 🤔

I'd better get another polio vax, in case a polio migrant comes into Canada, they might infect me ! 🤔
.",Rex66992401,NR,NR,NR,NR,0,
T4,304107,Imagine if you had learned how to count immigrants and visa holders...,rexglacer,O,A,0,,1,
T4,584705,Sanctuary city shithole Toronto where not one elected seat warmer will say a word about this...,rexglacer,O,A,0,,1,
T4,317144,"Most Canadian PRs who landed in 2022 were citizens of India, China and Afghanistan

India (118, 095 immigrants) – 27%
China (31,815 immigrants) - 7.2%
Afghanistan (23,735 immigrants) – 5.4%
Nigeria (22,085 immigrants) – 5.05%
Philippines (22,070 immigrants) – 5.04%

How many skilled home builders?",rexglacer,E,U,0,,0,0
T2,1337356,"Really? What kind of refugees other than illegals are not funded &amp; given aide by the Govt in Canada? 
This is John Tory's sanctuary city Toronto let him fund &amp; house these people, he invited them, whats the problem?",rexglacer,O,A,0,,1,
T2,1338060,Because dealing with sanctuary city Toronto gang &amp; gun violence is too boring for this Trudeau fart catcher...,rexglacer,O,A,0,Mia coded the stance as Unsure,1,
T4,330944,"@TeamTrump @RNCResearch Remember this
https://t.co/1A0iVKzslN
How a tall tale of immigrants soliciting kids for sex made it to Trump https://t.co/c1cmXCMQ9U",rhonda_harbison,F,A,1,,0,0
T2,1279951,"@RepGarbarino @All435Reps https://t.co/ciNTqu4Qw3
The Trump administration rejects its own study finding refugees help the ...",rhonda_harbison,T,P,1,,0,1
T4,184089,"@Acyn @aliasvaughn @SenJohnKennedy Republicans have nothing to campaign on if they don't have ""immigrants bad"".
https://t.co/ITmEMYCepo",rhonda_harbison,O,P,1,,1,
T4,401551,"@longood_patrick @mattyglesias https://t.co/bvUWAgVoKa
New data shows why the U.S. needs more immigrants",rhonda_harbison,T,P,1,,0,1
T4,372020,"@MarshaBlackburn @SecMayorkas https://t.co/JvYZ1uyvef
Trump, at Fund-Raiser, Says He Wants Immigrants From 'Nice ...",rhonda_harbison,T,I,1,,0,1
T2,1477872,"https://t.co/BTp8yByyI3
Prisons, border wall: How GOP is looking to use COVID money https://t.co/OYUGS3twpm",rhonda_harbison,T,A,1,,0,1
T2,1479106,"@mrssilentdogood @MP49660101 @GregAbbott_TX https://t.co/A6oYpG4oV4
Wave of suicides hits Texas National Guard's border mission",rhonda_harbison,T,I,1,,0,1
T4,469290,"@unknownwiam @TheGr8Illusion @elonmusk https://t.co/oGzw6Dmkt5
Why there's no big wave of immigrants voting illegally - Axios",rhonda_harbison,T,P,1,,0,1
T4,57067,"@RepMTG Ask the @freedomcaucus why they blocked border funding
https://t.co/kweEMtuRq2
Border security bill fails to lift U.S. House conservatives' block of ... https://t.co/OorCSNTWGI",rhonda_harbison,T,A,1,,0,1
T4,352127,"@MarshaBlackburn https://t.co/o63WB0LreI
Stop with the lies about 'criminal immigrants' - Chicago Sun-Times",rhonda_harbison,T,P,1,,0,1
T4,164263,"@DanMiressiCT https://t.co/QAXUhzPi6m
History confirms Republicans rejected a once-in-a-lifetime immigration ...",rhonda_harbison,E,A,1,,0,0
T4,153556,"@1of3littlebirds @JillPhys1905 @timkaine https://t.co/Q5dh7ugVaW
Following orders from Trump, GOP kills immigration legislation",rhonda_harbison,T,A,1,,0,1
T2,1487871,"@CasandraLGarcia @gc2speak0074 @PressSec GFY https://t.co/2lI9M3Loby
Ted Cruz Lashes Out at Fellow Republicans Over Immigration",rhonda_harbison,E,A,1,,0,0
T4,374645,"@MarshaBlackburn Sit down
https://t.co/JvYZ1uyvef
Trump, at Fund-Raiser, Says He Wants Immigrants From 'Nice ... https://t.co/ohXejVluGw",rhonda_harbison,O,A,1,,1,
T4,699766,"@MarshaBlackburn @SenSchumer Says the woman who voted against border funding not once but twice.
https://t.co/241IPckKum
NEW VIDEO: Blame Trump for Immigration Reform Chaos",rhonda_harbison,E,A,1,,0,0
T4,622781,"@The_Real_Fly @CDcaritas https://t.co/y9GV0JqtW0
Brooklyn teenager launches soccer clinic for migrant children with help ...",rhonda_harbison,T,P,1,,0,1
T4,391159,"@CollinRugg And Republicans teach children how to degrade other human beings
https://t.co/A13QvFsu6Z
Trump calls migrants 'animals,' intensifying focus on illegal ...",rhonda_harbison,O,P,1,,1,
T4,37206,"@RepMTG Republicans blocked their own immigration bill
https://t.co/kweEMtujAu
Border security bill fails to lift U.S. House conservatives' block of ... https://t.co/YqwX0apIvw",rhonda_harbison,T,U,1,News report,0,1
T4,125487,"https://t.co/Q5dh7ugnlo
Following orders from Trump, GOP kills immigration legislation",rhonda_harbison,E,A,1,,0,0
T4,16794,"@JohnWWhite12 @caringguy1957 @RepMTG Blatant lie
https://t.co/tLUbDevs30
No, Border Deal Won't 'Allow' 5000 Unauthorized Immigrants a Day",rhonda_harbison,T,P,1,,0,1
T4,213013,"@MarshaBlackburn @SenatorDurbin https://t.co/Wf0Li5X2O0
Monday numbers: New data show why the U.S. needs more immigrants",rhonda_harbison,O,P,1,,1,
T2,1464347,"@Lancegooden @All435Reps https://t.co/l9epW9LSZG
Nothing Donald Trump Says on Immigration Holds Up",rhonda_harbison,O,P,1,,1,
T4,374221,"@HomelandGOP @JudiciaryGOP https://t.co/JvYZ1uyvef
Trump, at Fund-Raiser, Says He Wants Immigrants From 'Nice ... https://t.co/WKLiUOHoOI",rhonda_harbison,T,P,1,,0,1
T4,123399,"@imjdsharp @DanCrenshawTX https://t.co/Q5dh7ugnlo
Following orders from Trump, GOP kills immigration legislation",rhonda_harbison,T,P,1,,0,1
T4,374237,"@RepBlaine @JudiciaryGOP Has @BillMelugin_or @FoxNews reported on this yet
https://t.co/JvYZ1uyvef
Trump, at Fund-Raiser, Says He Wants Immigrants From 'Nice ... https://t.co/87temO0ME5",rhonda_harbison,T,P,1,,0,1
T4,187683,"@MarshaBlackburn @SenatorDurbin The bipartisan immigration bill had Tim Scott's fentanyl amendment included in it. Do you speak to parents every day with children affected by gun violence?
https://t.co/FfhQ5xkWQn
Arming teachers: Students march on Tennessee Capitol to protest bill",rhonda_harbison,T,U,1,,0,1
T2,1489027,"@auctnr1 @All435Reps https://t.co/A6oYpG4oV4
Wave of suicides hits Texas National Guard's border mission",rhonda_harbison,T,U,1,,0,1
T4,374181,"@Congressman_JVD @JudiciaryGOP https://t.co/JvYZ1uyvef
Trump, at Fund-Raiser, Says He Wants Immigrants From 'Nice ... https://t.co/AsWsHNfeCI",rhonda_harbison,T,A,1,,0,1
T2,1258837,"@Lancegooden @All435Reps Selective amnesia huh https://t.co/AAET1HlaLX
Trump Administration Flying Migrants Out of Texas to Ease Overcrowding ...",rhonda_harbison,T,A,1,stance inconsistency: Sam coded as Unsure,0,1
T4,156762,"@NRSC Fearmongering BS
https://t.co/30zH8x9tl0
Testimony of David J. Bier Associate Director of Immigration Studies at ... https://t.co/tFq57hNEV7",rhonda_harbison,T,P,1,,0,1
