origin,Unnamed: 0,text,author.userName,misinformation,stance,isUSRelated,notes,opinion_label,true_label
T4,466382,"Immigrant demographics have changed - increasingly Latin American, illegal, and less educated. Education level is a concern as it is a key indicator of how people will fare in the modern economy.",CIS_org,O,A,1,,1,
T2,1478596,"In this week’s episode of Parsing Immigration Policy, Jerry Kammer explains how a left-right coalition of rights groups, ethnic activists, business interests, and civil libertarians thwarted the immigration reform law enacted by Congress in 1986.

https://t.co/3tMIL7A2XE",CIS_org,T,U,1,,0,1
T2,1210857,"“It’s clear what the former illegal immigrants themselves — now back in Haiti — want: a free flight to the US so they can apply for asylum, [which] would mean they’d be able to live here forever, whatever the eventual outcome of their asylum cases.”
https://t.co/I27sLxbJj2",CIS_org,T,U,1,,0,1
T2,1353798,"This eight-fold increase isn't compassionate -- not to the working-class Americans forced to compete with these desperate new arrivals for jobs and housing, and not to the refugees around the world who'd benefit from a more effective U.S. aid strategy.
https://t.co/F1sFuwKSWs",CIS_org,O,A,1,,1,
T3,1557747,"@dave24144975 “Would it not be better to try and deter illegals from coming HERE in the first place?”

UK can’t deter seekers or refugees from coming here, to do so would be in breach of the covert agreement UK govt has with France, Europe and the world to take a share of their migrants.",citizen_glasgow,O,A,0,,1,
T2,1466957,"@carolinesteel1 Of course Shami Chakrabati would demand the Immigration Bill be defeated. Her parents are Bengali Indian and she and they are immigrants. She promotes human rights, human rights for immigrants as herself whose human rights take priority over the human rights of British people.",citizen_glasgow,O,A,0,,1,
T2,1286629,"@ByrneBarry Duping officials, claiming asylum and illegally getting the right to stay is an oft used tactic. This Afghan did it -  Sabir Haziz, now CEO of the Scottish Refugee Council, for over 20 years he's been living the refugee's lie - a fraud.",citizen_glasgow,F,A,0,,0,0
T2,1227159,@Richard_1942 But will he be charged. Asylum seeker in Glasgow assaulted a young girl. The judge refused to prosecute lest a conviction would harm the asylum seeker’s asylum claim. I kid you not.,citizen_glasgow,F,A,0,,0,0
T2,1231787,"@sel2702 Question, does anybody think it's fair to charge 60 to 66 year olds or anybody of any age for prescriptions in England, when asylum seekers and refugees get them free at any age?",citizen_glasgow,E,A,0,,0,0
T4,691087,"@fenwickone British Govt lets it happen because that stops the intended deportees from being deported. Govt relies on lawyers to block deportations. If this fails, the deportess will thrash about on the 'plane to get the pilot to put them off the 'plane. Been going on for years, it works.",citizen_glasgow,F,A,0,,0,0
T2,1250401,"@daninspain70 @pritipatel In Glasgow there are refused asylum seekers who've been here for 20 years plus, still living all free to them in asylum accommodation, Serco who used to provide the overstayers asylum homes was blocked from removing the illegals. Ditto for Mears, can't evict them.",citizen_glasgow,E,A,0,,0,0
T4,657134,"@KISSARM48156677 If an asylum seeker or refugee turned up on her doorstep, she would lock her door, pull down her blinds, put out her lights and call the police to take her unwelcome intruder to a more downmarket working-class area. NIMBY hypocrites all.",citizen_glasgow,O,A,0,,1,
T3,1570072,"@NHPUKOfficial If an asylum seeker or refugee turned up on King Charlie’s doorstep his butler would lock the door, pull down the blinds, put out the lights and call the police to take King Charlie’s unwelcome intruder to a more downmarket working-class area.",citizen_glasgow,O,A,0,,1,
T2,1189050,"@NeilEastell One crossbow makes an appearance, Home Secretary intervenes to change law. Hundreds of thousands, millions of illegal lying invading migrants make their appearance - nothing, status quo.",citizen_glasgow,O,A,0,,1,
T2,1247880,"@ByrneBarry Not we, it's them, Boris &amp; Co aren't negotiating, they're taking the knee to the French, same as they're doing with France's sailed over unwanted migrants. Boris ain't no Churchill.",citizen_glasgow,O,A,0,,1,
T2,1385836,"@ByrneBarry @RishiSunak Substitute ""tens of millions"" for tens of £billions and we've a closer idea of the real cost of the unknown numbers of seekers, refugees, assorted migrants and their follow on families. It's the likes of Boris &amp; Co who've never had any sense or backbone.",citizen_glasgow,E,A,0,,0,0
T4,599463,"@RadioGenoa Part reason why the French are offloading their migrants onto the UK and our politicians have accepted over hundreds of thousands of these uneducated worthless wandering nomad scum. Nobody wants them, but Britiain is getting them for the long haul.",citizen_glasgow,E,A,0,,0,0
T3,1532210,Yes indeed. @POTUS @SenateDems @RepJayapal @SenatorMenendez @USCIS @USCISDirector @SenatorSinema @ajainb @ImproveTheDream @TheDipPatel @DcWalaDesi #Immigrants #greencardbacklog #immigration,CK11N2008,T,P,1,,0,1
T4,440953,Do You know since Covid 100+ HighSkilled #immigrants passed away &amp; their families had to deport? They were in #greencardbacklog for over a decade for next 150 YEARS. You are sitting on this unjust law&amp;possible EAD reliefs. @USCIS @SecBlinken @SecMayorkas @ajainb @POTUS @WHIAANHPI,CK11N2008,T,P,1,,0,1
T3,1544171,The question is who is willing to staple? @SenateDems @RepJayapal @POTUS @CongressmanRaja @USCIS @USCISDirector #Immigration #greencardbacklog,CK11N2008,O,U,1,,1,
T3,1521433,Are you aware of this reality @elonmusk ? #greencardbacklog #Immigration #Immigrants #legalimmigration @POTUS @SenateDems @RepJayapal @SenAlexPadilla @SenSchumer @USCIS @USCISDirector @DcWalaDesi @FareedZakaria @TheProblem @legalHSKpanda,CK11N2008,O,P,1,,1,
T4,239681,"You guys live in your bubble &amp; cry for support when you are at receiving end. Nearly 1.8 Million HighSkilled immigrants are stuck in #greencardbacklog for next 150 years, majority of them are Indians but not a word of support from you guys. @immivoice @RepShriThanedar",CK11N2008,O,U,1,,1,
T4,163663,"Immigration Update for April 17, 2004 https://t.co/75ioEUe31n",ckuck,T,I,1,,0,1
T4,165575,IMMPact IMMigration LItigation Update https://t.co/FPHZYL5pM9,ckuck,NR,NR,NR,the link is not valid any more,0,
T4,465620,"More Immigrants = More Job Growth = Growing Economcy = Better for All Americans.

Increase #Immigration!

https://t.co/2zc1v8Nsx7",ckuck,T,P,1,,0,1
T2,1289168,"Looks like the AG is reviewing another decision from one of the former Atlanta Deportation Judges with a 99% asylum denial rate, who sat on this panel as an immigration appellate judge. At least there is that.  https://t.co/sX3f3q0Xfk",ckuck,T,P,1,,0,1
T2,1371956,"@USCIS changing the rules midstream on Humanitarian Parole for Afghans:  ""It’s intended only for people in extreme circumstances who are not included in the operation, and are unable to wait for refugee resettlement."" @UrJaddou what do you think is happening in Afghanistan?",ckuck,O,P,1,,1,
T2,1388600,"#ImmigrationReform legislation should allow the great majority of the 10.35 million US #undocumented residents to legalize, reform the underlying legal immigration system, and create a rolling #registry program. @cliniclegal @NILC

Learn more: https://t.co/5MjcOFzVI4",CMSnewyork,O,P,1,,1,
T2,1164661,"CMS is committed to person-centered #research and public #policy. That means work rooted in the needs and experiences of refugees and immigrants and carried out in collaboration with affected migrant populations and those who work with them. 

Support CMS: https://t.co/SQUvGRU8r1",CMSnewyork,O,P,1,,1,
T2,1285496,"Women and girls have been known to face an increased risk of gender-based violence in low-lit areas. New #satellite monitoring #technology could help identify low-lit areas in #refugee camps and prevent violence.  @UNDESA @UN @UNHCR_BGD

Learn more:
https://t.co/YQTuKi29RN",CMSnewyork,T,P,1,,0,1
T4,691002,"US gov’t on pace to resettle close to 100k #refugees in FY 2024, having resettled over 48k from around the world. Largest totals arrived from Democratic Republic of the Congo (1,993), #Venezuela (573), #Afghanistan (1,031) &amp; #Syria (594).
@refugees @dhsgov
https://t.co/b6TEaDJYgW",CMSnewyork,T,U,1,,0,1
T2,1142950,"Immigration reform legislation should allow the great majority of US #undocumented residents to legalize and should provide for the #legalization of future long-term undocumented residents through a rolling #registry program. @ProfRBoswell

Read more: https://t.co/5MjcOFzVI4",CMSnewyork,O,P,1,,1,
T3,1553120,"This week’s #MigrationUpdate: @JoeBiden admin makes #DACA recipients eligible for healthcare coverage, safety net gaps leave #immigrant children vulnerable to poverty, rising #migrant deaths in the #Mediterranean &amp; more #migration news!

Read &amp; #subscribe: https://t.co/JLNvubgsCr",CMSnewyork,T,P,1,,0,1
T2,1151973,"#ImmigrationReform legislation should allow the great majority of the 10.35 million US #undocumented residents to legalize, reform the underlying legal immigration system, and create a rolling #registry program. @AmericasVoice @ReadyCoalition 

Learn more: https://t.co/5MjcOFzVI4",CMSnewyork,O,P,1,,1,
T4,123686,"The #immigration court backlog: FY 2023 saw it surge to 2.5M cases, a 672k increase in just 1 yr. Delve into the complexities of this issue &amp; learn why addressing the backlog demands more than just staffing adjustments.
@cliniclegal @the_ILRC @ImmDefense
https://t.co/iwQNohVlsD https://t.co/MSYk7ZfHDQ",CMSnewyork,T,U,1,,0,1
T2,1263070,"At a moment when the #Omicron variant is spreading rapidly within the United States, @ICEgov has not released data on what percentage of the approximately 22,500 detained #immigrants in its custody are #vaccinated. 

Read more via @NPR: 
https://t.co/nePwRBCbMz",CMSnewyork,T,U,1,,0,1
T3,1561187,"@LBC Take two guesses which country will be falling over itself to offer Khan asylum? There’s a vacancy coming up soon if he’s looking for his next venture. UK PM. He’ll definitely meet the approval of our establishment. Trending. Scotland, Ireland, possibly even Wales soon.",coachnhorses11,E,A,0,,0,0
T4,165251,@LBC Tom your idiot of a guest pleading for more immigration should be thrown in jail without trial,coachnhorses11,O,A,0,,1,
T2,1170300,"@LBC How about the Afghan &amp; rest of the muslim migrants be given 'shelter' in the Cotswolds, the better parts of Berkshire or Surrey?",coachnhorses11,O,A,0,,1,
T4,358510,@LBC Do you mean the Rwanda-bound illegals know someone in Rwanda? You just let the cat out of the bag Ben. Only the black illegals are going to be sent to Rwanda.,coachnhorses11,F,U,0,,0,0
T4,165662,@LBC C’mon Tom. Our immigration authorities are instructed not to turn away any South Asian who claims to be a doctor.,coachnhorses11,F,A,1,,0,0
T3,1557803,Woke Biden moves to extend health care coverage to more than half-million DACA migrants - Maybe give them all a starter home as well? https://t.co/nVcmp2UQ3a via @nypost,contrariansmind,E,A,1,,0,0
T2,1349964,South Africa in the middle of a massive emigration wave as more skilled professionals resign https://t.co/7szszf5aSB via @businesstechSA,contrariansmind,T,U,0,,0,1
T4,530338,Texas Judge Orders Release of Illegal Immigrants Accused of Border Riot https://t.co/CRWwYJGMjO via @epochtimes,contrariansmind,T,A,1,,0,1
T2,1171694,"@MaltonView @Hughie1953 Once Vax 'passport' horrific add-on's are debated he'll be in the weeds
No sane or decent person wants to live in a social credit system world
Add this to increased illegals/asylum seekers, green/energy huge price hikes &amp; NI/Tax huge hikes
Issues he created that cause destruction",coulson_elle,E,A,0,,0,0
T3,1569425,"@Dave_202_ @Arcee_TG @SickOfEverythi6 @AyoCaesar Just last year 1.2 Million migrants, little wonder every public service battered
Massive 220 Billion benefits bill 2022 &amp; 4 Billion given to EU citizens, so why the 'eck are we keeping folk who've supposedly come here to work
Despite huge financial costs, social is most worrying",coulson_elle,E,A,1,,0,0
T2,1177268,"@ByrneBarry @MailOnline Live? Where? More burden on crumbling Public Services Millions of small businesses lost thousands when shut down to 'protect NHS'
Hundreds of thousands are homeless &amp; families living in temp 1 room accom
Hotels crammed with asylum seekers
Not a slither of a brain cell in Govt",coulson_elle,O,A,0,,1,
T3,1490624,"@Mevkads7 @SerenaJB3 In the same time period Brits were emigrating to  Oz with their Govt offered 10 bob tickets
Coincidence? I think not",coulson_elle,E,U,0,,0,0
T2,1082033,"@cj_buzz @KathrynBuxton2 Migrants grow old just as those born here do
Then you dig deeper into the stats using your 80's start and see who worked, ethnicity % etc, then compare to 2021 and know why we have a huge problem",coulson_elle,T,A,1,,0,1
T2,1228938,@chavistec @jemmm85517813 @respect65 In courts to stop deporting illegal migrant criminals.,crazyzombienerd,O,P,0,,1,
T2,1143993,"@SDMR007 @Richard_1942 @OpenshawJack What application? They are not asylum seekers, they are scroungers. If they were seeking asylum, they would do so in the 1st safe country they reached.",crazyzombienerd,F,A,0,,0,0
T2,1143745,"@PetenShirl @MailOnline When I worked in housing, it always amazed me how easy it was for so called asylum seekers &amp; refugees living on benefits, to acquire cars often even without a driving licence.",crazyzombienerd,E,A,0,,0,0
T2,1310906,@PetenShirl Even I coming from a legal immigrant stock agree that UK needs to stop ALL migrarion/immigration until people already in the country are sorted. We have enough people lounging on benefits to fill a lot of job vacancies.,crazyzombienerd,O,A,0,,1,
T4,74197,"@mrmrnononsense @SeekHisFaceUK @DaveAtherton20 @RishiSunak Of course, immigrants with UK citizenship can get disability &amp; all other benefits.",crazyzombienerd,T,U,0,,0,1
T2,1386374,"@jeremypssm @kinyenoC Yep, &amp; like all the illegal migrants who get priority over every UK citizen.",crazyzombienerd,F,A,0,,0,0
T4,518737,"Police have charged with murder the boyfriend of an Irish immigrant bartender stabbed to death inside the Queens pub where she worked.

Marcin Pieciak, 36, had a knife in both hands when he allegedly attacked girlfriend Sarah McNally inside Ceili House in Maspeth Saturday evening. He then turned the knives on himself and was initially listed in critical condition.

He is charged with two counts of weapon possession in addition to murder.

Pieciak and McNally, a native of Longford, Ireland,had been living together in Glendale for about a year.

Pieciak has been arrested for domestic violence before but it wasn’t immediately clear if these attacks involved McNally.

https://t.co/vkJ6aqA2Od",CrimeInNYC,T,U,1,,0,1
T3,1558640,"For a moment I thought ""We have a few new folks joining the team"" referred to all the migrants pouring across the border.",CrimeInNYC,O,A,1,,1,
T4,400707,"It is only a matter of time before demands begin to expand coverage to ""undocumented immigrants"" - as we delicately like to describe them - below the age of 65.

Those who spend their lives working on the books and paying taxes will cover the costs.",CrimeInNYC,E,A,1,,0,0
T3,1577498,"What happens if Texas sends another 10,000 or so? What if they send another 50,000? Then what happens?
--------------------------

GOP Rockland County Executive Ed Day had warned over the weekend that he already had cops deployed to thwart any incoming migrants sent from the Big Apple — adding, “Mr. Adams, you can try to run us over, [and] I will reach up and grab you by the throat for the people of Rockland County.”

[Orange County Executive Steve] Neuhaus, also a Republican, revealed earlier Tuesday that Adams contacted him last week to say the city was going to pay for about 60 migrants to stay at the Crossroads Hotel in Newburgh in Orange.

Under the counties’ state-of-emergency declarations, hotels, motels and other short-term rentals in the region are prohibited from accepting asylum-seekers bused there.

Newburgh Town Supervisor Gil Piaquadio said Tuesday that town codes already prohibit hotels or motels from being used as shelters there.

“A shelter is not permitted at the Crossroads Hotel,” he said in a statement.

“The Town of Newburgh has a litany of procedures for outside governments to follow when these outside governments, like New York City, propose a use in another jurisdiction. New York City still needs to follow these procedures.”

https://t.co/ATgZbkILhs",CrimeInNYC,T,U,1,stance inconsistency: Sam coded as Anti-immigration,0,1
T4,599249,"When you don't defend the outer perimeter, the disrespect for boundaries advances to the interior. 💡
===============

A New York Home Depot has deployed a guard dog — and other stores may be close behind — to protect shoppers from aggressive migrants and thieves flooding their parking lots.

Two men wearing MSA Security caps and bulletproof vests with a German Shepherd in tow patrolled the Home Depot in New Rochelle on Tuesday.

The guarded New Rochelle lot was quiet and no migrants loitered there when The Post visited this week, however, seven miles away in Throggs Neck, The Bronx, at least 30 male migrants hovered at the doors of Home Depot.

Some were day laborers simply trying to “shape” for work with local contractors.

But many others aggressively confronted shoppers, trying to sell them phony Apple Airpods or soliciting tips for lifting items from shopping carts into cars — even when uninvited.

“You come out and you’re a woman by yourself, they literally leech onto your wagon, and you’re like ‘No, I don’t need any help,'” one worker said. “And when they’re following you to your car, it’s unnerving.”

She said a female supervisor saw one of the men washing his privates with a water bottle in the lot, and that several women have called customer service to complain that migrants robbed them of purses or phones.

“I came to work one day and there had to be 100 guys out here,” she said. “And I’m like, ‘Oh, my God!'”

https://t.co/Ev35IzmiMf",CrimeInNYC,E,A,1,,0,0
T2,1338590,@csomalian @POTUS @VP @hamse_warfa  Refugees and immigrants are hopeful and he must fight against Humanitarian Corruption of the @Refugees as a Globally to save refugees lives. https://t.co/BuvW7IQuhG,csomalian,O,P,1,,1,
T4,850487,"@csomalian @POTUS  @FLOTUS  @Ilhan @IlhanMN  @RepRashida @RashidaTlaib @RepAOC @AOC YOUNG Representives of @TheDemocrats party and their efforts.

On the other hand just Remaining Humanitarian Corruption in INDIA for the past three decades that is all.
@Refugees @UNmigration @VP https://t.co/ZsO7lkFeBz",csomalian,NR,NR,NR,"NR, discusses political figures and organizations",0,
T3,1516500,"@csomalian @Refugees Do no depending upon the Corrupted organization of the UNHCR UNHCR across #INDIA.

@UNmigration  @IOMatUN  @JoeBiden  @POTUS  @FLOTUS  @DrBiden  @VP  @Ilhan  @RepJayapal @JustinTrudeau @HonAhmedHussen @narendramodi @AmitShahOffice  @AmitShah @RahulGandhi https://t.co/wcHxDs1dgs",csomalian,O,A,0,,1,
T4,372809,"@philipnolan1 Not to mention that all immigrants coming to Ireland need to be ""deprogrammed"" because they've been brainwashed and infiltrated by ISIS.",culladgh,F,A,0,,0,0
T3,1541132,@Fitzydub @rtenews Denying children seeking asylum 4 euro a day Paul? And you want to send them home? Do you care about children Paul? Or are you just this wicked?,culladgh,E,P,0,,0,0
T4,492985,"@Fitzydub @griptmedia I read this and I cannot help but think that you would feel very different if it was an immigrant defending themselves from you and your racists pals. I know it, you know it and the baby Jesus knows it.",culladgh,O,P,1,,1,
T2,1479578,"@mark_omahony1 Covid19 aside, traveling to the states.

ESTA Visa
Immigration questions, scan fingerprints, iris scan and photo taken.

Throw in covid rules.

I suppose Dublin Airport is like North Korea.",culladgh,E,P,0,Mia coded the stance as Unsure,0,0
T2,1271367,November 2021 Immigrant Visa Statistics show only 16 #DV2022 visas issued worldwide in that whole month. https://t.co/L8ZYiyiRvh https://t.co/7olIZ5p0xa,curtismorrison,T,I,1,,0,1
T2,1375252,Note: the only reason we’re having to brief this motion is because the anti-Immigrant Biden Administration continues to refuse to issue immigrant visas to family members of US citizens and green card holders.,curtismorrison,F,P,1,refuse and anti-immigration is an exaggeration. Check Biden immigration policies,0,0
T4,502037,"Just found out that an Assistant US Attorney who defends @StateDept in lawsuits filed by immigrant families works in the criminal division, and not the civil division. Feels sketch.",curtismorrison,O,A,1,,1,
T4,151019,Let's Talk Immigration - E74 https://t.co/zBVjGuAdqu,curtismorrison,T,P,1,,0,1
T4,518897,"Reflecting on how 3 months of the ""Year of the Immigrant Visa"" have gone by but @StateDept has yet to announce it exists, except to AILA.
https://t.co/FBzcVLPJdr https://t.co/Q91LRlQaRE",curtismorrison,T,P,1,,0,1
T2,1169724,Priti reveals plans to target eco-mob and asylum fix in 2022 https://t.co/aTsPKnoMEz,Daily_Express,T,U,0,,0,1
T2,1118538,"Migrant crossings 2021 data in full as Channel trips increase threefold
https://t.co/yIlCXDrjhv https://t.co/QQNslEFqth",Daily_Express,T,U,0,,0,1
T2,1175217,"Migrant crisis: 'Large stone unturned' in fight against smugglers – Boris told to act

https://t.co/5gZOCUNQnf https://t.co/MrZnJPkegO",Daily_Express,T,U,0,,0,1
T2,1173830,Not this hard on terrorists or migrant traffickers' Macron brutally shut down over curbs https://t.co/vcmRI1RBO0,Daily_Express,E,A,0,,0,0
T2,1248007,"Plea to ‘toughen asylum laws’ after more migrants attempt to cross Channel

https://t.co/c7Eevmo5U2",Daily_Express,T,A,0,,0,1
T3,1580662,"🚨EXCLUSIVE🚨 from @JennieSTaer &amp; @DRJasonPiccolo 

ICE Memo Calls For 'Rapidly Releasing' Illegal Immigrants Ahead Of Trump-Era Border Policy's End

https://t.co/XSozIJFEEG",DailyCaller,T,U,1,,0,1
T4,412656,"Blue State Public Official Reveals How Much Taxpayers Are Paying for 'Unsustainable' Illegal Immigrant Policies
https://t.co/AD9XiOr08P",DailyCaller,E,A,1,,0,0
T4,241193,"National Guard in Texas takes on illegal immigrants

 https://t.co/LQ8HEuWbGs",DailyCaller,T,A,1,,0,1
T3,1526014,Biden’s admin is restricting asylum access ahead of Title 42’s end https://t.co/D8PZRHB9FD,DailyCaller,T,U,1,,0,1
T4,456895,"Dem Mayor Defended Shielding Illegal Immigrants From ICE Days After Laken Riley Murder, Emails Show https://t.co/cXaCHDwLkn",DailyCaller,T,A,1,,0,1
T4,532675,"@ReichlinMelnick For sure, I'm just saying there's nothing surprising in their tweet. The program is targeted at four Florida heavy immigrant groups",DanielDiMartino,T,U,1,,0,1
T4,519375,@ColopyC @reason @cesarbaezc This is one of the very few agencies that is fully self funded. The vetting and processing of his application was paid by other legal immigrants paying our fees. I wish that wasn't the case and this parole process had a fee but it's not taxpayer dollars allocated by congress.,DanielDiMartino,T,U,1,,0,1
T4,518999,@MrNOVApolitico Agree and that is the same case for any immigrant from these countries and many others. That's why vetting and requiring sponsors is critical for any process. And focusing additional vetting on young unmarried men who are the overwhelming majority of criminals.,DanielDiMartino,E,U,1,,0,0
T2,1049529,At this pace there will be more people *emigrating* from America than immigrating here. This is terrible news for the shining city on a hill.,DanielDiMartino,F,U,1,,0,0
T3,1584522,"Imagine: Nuclear power, high skilled immigration, permitting reform, liberalization of zoning and housing regulations... America BOOMS",DanielDiMartino,O,I,1,,1,
T4,576358,@ReichlinMelnick They're running out of people and will eventually be totally depopulated due to low fertility and emigration.,DanielDiMartino,E,A,0,,0,0
T4,634811,"😂😂😂

#LiftTheBan

Peter is seeking asylum in the UK

Peter is from the Sudan 'Say no more'

Give Peter a Christian forename rather then a Muslim name!!!

I have not seen too many Sudanese Christians make to the UK alive!!! https://t.co/FSAQpAARP0",dave24144975,O,P,0,,1,
T2,1286913,"😡😡😡

Afghan asylum seeker Rasuili Zubaidullah

Drugged, raped &amp; suffocated 13-year-old schoolgirl Leonie Walner.

Fled hundreds of miles to Dunkirk evading a pan-European manhunt before boarding a trafficker's boat to Britain &amp; then onto a luxury hotel!
https://t.co/Kl41zTSjTF https://t.co/NhcE0qyZZT",dave24144975,T,A,0,,0,1
